{
  "schema_version": "0.4.0",
  "document_type": "point_dictionary_extension",
  "document_status": "extension_for_review",
  "generated_at": "2026-08-07T00:00:00Z",
  "extends": "data/point_dictionary.yaml",
  "merge_target": "data/point_dictionary.yaml",
  "source_document": "Homestead_Digital_Twin_Software_Design_Document_v0.3.md",
  "work_queue_item": "49.5",
  "control_narrative": "docs/water-control-narrative.md",
  "purpose": "Water points required by SDD section 12.3 (FR-200 to FR-205) and the water control narrative that the v0.3 point dictionary does not already define. Existing point names are reused wherever one fits.",
  "provenance": {
    "dictionary_status": "reconciled_v0_4",
    "convention": "Extends the SDD section 45 provenance ladder: baseline_v0_2 is a direct v0.2 translation, reconciled_v0_3 closed internal references during the v0.3 pass, and reconciled_v0_4 is a new formal definition added by the water pass. Nothing marked reconciled_v0_4 is a previously settled decision."
  },
  "point_name_pattern": "^[a-z][a-z0-9_]*$",
  "point_path_format": "<asset_id>/<point_name>",
  "canonical_units_added": {
    "kPa/min": "kilopascals per minute",
    "%/h": "percent per hour",
    "count/h": "counts per hour",
    "L/d": "litres per day"
  },
  "reused_existing_points": {
    "description": "Points the water systems need that the v0.3 dictionary already defines. Listed so a reviewer can see that this extension adds only what is genuinely missing.",
    "points": [
      "alarm_summary",
      "availability_state",
      "calibration_due",
      "closed_limit",
      "control_owner",
      "current_a",
      "diverter_position",
      "dry_run_active",
      "ec_ms_cm",
      "fault_active",
      "fault_code",
      "flow_instant_lpm",
      "flow_proven",
      "flow_total_m3",
      "freeze_lockout_active",
      "high_level_active",
      "interlock_block_reason",
      "interlock_permissive",
      "irrigation_active",
      "irrigation_demand_mm",
      "irrigation_requested",
      "leak_active",
      "level_pct",
      "low_level_active",
      "manual_override_active",
      "mode_actual",
      "mode_requested",
      "open_limit",
      "ph",
      "position_actual_pct",
      "position_requested_pct",
      "pressure_differential_kpa",
      "pressure_discharge_kpa",
      "pressure_suction_kpa",
      "pump_run_request",
      "pump_speed_requested_pct",
      "quality_in",
      "quality_out",
      "reverse_flow_active",
      "runtime_total_h",
      "service_due",
      "soil_moisture_vwc_pct",
      "starts_total",
      "state_operating",
      "temperature_liquid_c",
      "throughput_total_m3",
      "turbidity_ntu",
      "volume_estimated_l",
      "volume_today_l",
      "water_level_m",
      "water_quality_status",
      "water_temperature_c"
    ]
  },
  "points": {
    "pressure_line_kpa": {
      "default_class": "AI",
      "allowed_classes": [
        "AI"
      ],
      "data_type": "float",
      "unit": "kPa",
      "description": "Static or working pressure in a distribution line at a monitored point, independent of any pump.",
      "control_capable": false,
      "automatic_control_default": false,
      "applicable_asset_classes": [
        "pressure_sensor",
        "valve",
        "filter",
        "treatment_stage"
      ],
      "source_section": "12.3 FR-200",
      "dictionary_status": "reconciled_v0_4",
      "notes": "The v0.3 dictionary defines suction, discharge and differential pressure but no line pressure. Leak detection needs a pressure that is not tied to a running pump."
    },
    "temperature_line_c": {
      "default_class": "AI",
      "allowed_classes": [
        "AI"
      ],
      "data_type": "float",
      "unit": "°C",
      "description": "Pipe surface or in-line temperature used for freeze exposure assessment.",
      "control_capable": false,
      "automatic_control_default": false,
      "applicable_asset_classes": [
        "sensor",
        "valve",
        "pump"
      ],
      "source_section": "12.3 FR-204",
      "dictionary_status": "reconciled_v0_4",
      "notes": "temperature_liquid_c describes stored liquid; this point describes an exposed line."
    },
    "water_source_selected": {
      "default_class": "DI",
      "allowed_classes": [
        "DI"
      ],
      "data_type": "enum",
      "unit": null,
      "description": "Water source currently supplying the served system.",
      "control_capable": false,
      "automatic_control_default": false,
      "applicable_asset_classes": [
        "controller",
        "tank",
        "pump"
      ],
      "source_section": "12.3 FR-201",
      "dictionary_status": "reconciled_v0_4",
      "enum_values": [
        "well",
        "rainwater",
        "potable_storage",
        "graywater_reuse",
        "external_delivery",
        "none",
        "unknown"
      ],
      "notes": "Distinct from source_selected, which the v0.3 dictionary defines for electrical ATS and inverter sources."
    },
    "volume_source_today_m3": {
      "default_class": "CALC",
      "allowed_classes": [
        "CALC",
        "COUNTER"
      ],
      "data_type": "float",
      "unit": "m³",
      "description": "Volume delivered from a source since local midnight.",
      "control_capable": false,
      "automatic_control_default": false,
      "applicable_asset_classes": [
        "flow_meter",
        "well",
        "tank",
        "controller"
      ],
      "source_section": "12.3 FR-201",
      "dictionary_status": "reconciled_v0_4"
    },
    "volume_use_today_m3": {
      "default_class": "CALC",
      "allowed_classes": [
        "CALC",
        "COUNTER"
      ],
      "data_type": "float",
      "unit": "m³",
      "description": "Volume consumed by a use since local midnight.",
      "control_capable": false,
      "automatic_control_default": false,
      "applicable_asset_classes": [
        "flow_meter",
        "irrigation_zone",
        "graywater_branch",
        "controller"
      ],
      "source_section": "12.3 FR-201",
      "dictionary_status": "reconciled_v0_4"
    },
    "volume_unaccounted_today_m3": {
      "default_class": "CALC",
      "allowed_classes": [
        "CALC"
      ],
      "data_type": "float",
      "unit": "m³",
      "description": "Metered source volume minus metered use volume minus storage change, since local midnight.",
      "control_capable": false,
      "automatic_control_default": false,
      "applicable_asset_classes": [
        "controller"
      ],
      "source_section": "12.3 FR-201, FR-202",
      "dictionary_status": "reconciled_v0_4",
      "notes": "Unaccounted volume is the balance residual. It is evidence for a leak, not proof of one."
    },
    "volume_balance_error_pct": {
      "default_class": "CALC",
      "allowed_classes": [
        "CALC"
      ],
      "data_type": "float",
      "unit": "%",
      "description": "Unaccounted volume expressed as a percentage of metered source volume over the accounting window.",
      "control_capable": false,
      "automatic_control_default": false,
      "applicable_asset_classes": [
        "controller"
      ],
      "source_section": "12.3 FR-201",
      "dictionary_status": "reconciled_v0_4"
    },
    "water_balance_state": {
      "default_class": "CALC",
      "allowed_classes": [
        "CALC",
        "DI"
      ],
      "data_type": "enum",
      "unit": null,
      "description": "Quality of the source-to-use balance over the accounting window.",
      "control_capable": false,
      "automatic_control_default": false,
      "applicable_asset_classes": [
        "controller"
      ],
      "source_section": "12.3 FR-201",
      "dictionary_status": "reconciled_v0_4",
      "enum_values": [
        "balanced",
        "drifting",
        "unbalanced",
        "insufficient_metering",
        "unknown"
      ],
      "notes": "insufficient_metering is the honest state when a source or use has no meter, and must not read as balanced."
    },
    "flow_unexpected_active": {
      "default_class": "DI",
      "allowed_classes": [
        "DI",
        "ALARM",
        "CALC"
      ],
      "data_type": "boolean",
      "unit": null,
      "description": "Flow is present while no scheduled or acknowledged demand explains it.",
      "control_capable": false,
      "automatic_control_default": false,
      "applicable_asset_classes": [
        "flow_meter",
        "controller"
      ],
      "source_section": "12.3 FR-202",
      "dictionary_status": "reconciled_v0_4"
    },
    "flow_continuous_duration_min": {
      "default_class": "CALC",
      "allowed_classes": [
        "CALC"
      ],
      "data_type": "float",
      "unit": "min",
      "description": "Elapsed time for which flow has remained continuously above the no-flow threshold.",
      "control_capable": false,
      "automatic_control_default": false,
      "applicable_asset_classes": [
        "flow_meter",
        "controller"
      ],
      "source_section": "12.3 FR-202",
      "dictionary_status": "reconciled_v0_4"
    },
    "pressure_decay_rate_kpa_min": {
      "default_class": "CALC",
      "allowed_classes": [
        "CALC",
        "AI"
      ],
      "data_type": "float",
      "unit": "kPa/min",
      "description": "Rate of pressure loss in an isolated or quiescent line, used as leak evidence.",
      "control_capable": false,
      "automatic_control_default": false,
      "applicable_asset_classes": [
        "pressure_sensor",
        "controller"
      ],
      "source_section": "12.3 FR-202",
      "dictionary_status": "reconciled_v0_4"
    },
    "level_loss_rate_pct_h": {
      "default_class": "CALC",
      "allowed_classes": [
        "CALC"
      ],
      "data_type": "float",
      "unit": "%/h",
      "description": "Rate of vessel level loss with no metered draw, corrected for known usage.",
      "control_capable": false,
      "automatic_control_default": false,